{
  "$schema": "https://json-schema.org/draft/2020-12/schema",
  "title": "Image-ad production record",
  "type": "object",
  "additionalProperties": false,
  "required": [
    "schema_version",
    "product",
    "outputs"
  ],
  "properties": {
    "schema_version": {
      "type": "string",
      "const": "1.0"
    },
    "product": {
      "type": "string",
      "minLength": 1
    },
    "brand": {
      "type": "string",
      "minLength": 1
    },
    "notes": {
      "type": "string",
      "minLength": 1
    },
    "outputs": {
      "type": "array",
      "minItems": 1,
      "items": {
        "type": "object",
        "additionalProperties": false,
        "required": [
          "index",
          "status",
          "aspect_ratio",
          "prompt",
          "copy_on_image"
        ],
        "properties": {
          "index": {
            "type": "integer",
            "minimum": 0
          },
          "status": {
            "type": "string",
            "enum": [
              "draft",
              "generated",
              "verified"
            ]
          },
          "aspect_ratio": {
            "type": "string",
            "enum": ["1:1", "9:16"]
          },
          "model": {
            "type": "string",
            "minLength": 1
          },
          "prompt": {
            "type": "string",
            "minLength": 1
          },
          "copy_on_image": {
            "type": "string",
            "minLength": 1
          },
          "file": {
            "type": "string",
            "minLength": 1
          },
          "result_url": {
            "type": "string",
            "minLength": 1,
            "pattern": "^https://"
          },
          "job_id": {
            "type": "string",
            "minLength": 1
          },
          "width": {
            "type": "integer",
            "minimum": 1
          },
          "height": {
            "type": "integer",
            "minimum": 1
          },
          "checks": {
            "type": "object",
            "additionalProperties": false,
            "properties": {
              "text": {
                "type": "boolean"
              },
              "product": {
                "type": "boolean"
              },
              "layout": {
                "type": "boolean"
              },
              "claims": {
                "type": "boolean"
              }
            }
          },
          "notes": {
            "type": "string",
            "minLength": 1
          }
        }
      }
    }
  }
}
